{
  "canonical_id": "BR-COREN-SP-DEC-PLEN-006-2024",
  "object_type": "COREN_REGULATORY_ACT",
  "schema_version": "2.0.0",
  "issuer": {
    "code": "SP",
    "name": "Conselho Regional de Enfermagem de São Paulo",
    "short_name": "Coren-SP"
  },
  "jurisdiction": {
    "state": "São Paulo",
    "country": "Brasil"
  },
  "act_type": "DECISAO",
  "identifier": "Decisão Coren-SP/Plenário/006/2024",
  "date": "2024-01-19",
  "title": "Institui Comissão Permanente de Normas Internas do Coren-SP",
  "summary": "Decisão plenária que institui comissão permanente para examinar, emitir pareceres e definir redação final de proposições de decisões e normas internas submetidas ao Plenário.",
  "source": {
    "url": "https://ouvidoria.cofen.gov.br/uploads/403148-decisao-coren-sp-plenario-006-2024.pdf",
    "host": "ouvidoria.cofen.gov.br",
    "kind": "official_system_copy",
    "authority_class": "OFFICIAL_FEDERAL_SYSTEM_COPY",
    "evidence_source_ref": "ES-BR-COREN-SP-DEC-PLEN-006-2024-001"
  },
  "epistemic": {
    "content_level": "SUMMARY",
    "status": "SOURCE_VERIFIED_METADATA_AND_SUMMARY",
    "full_text_status": "SOURCE_AVAILABLE_NOT_MATERIALIZED_IN_PACKAGE",
    "legal_status": "NOT_INFERRED",
    "legal_status_basis": {
      "kind": "NONE",
      "statement": "Nenhum estado jurídico foi declarado. O pacote não infere vigência.",
      "evidence_fragment_ref": null
    }
  },
  "version_envelope": {
    "content_version": "1.0.0",
    "source_version": "UNVERSIONED_SOURCE_NOT_ACQUIRED",
    "first_seen": "2026-08-24",
    "last_reviewed": "2026-08-26",
    "changesets": []
  },
  "evidence": {
    "source_refs": [
      "ES-BR-COREN-SP-DEC-PLEN-006-2024-001"
    ],
    "fragment_refs": [],
    "ipe_ref": "IPE-BR-COREN-SP-DEC-PLEN-006-2024",
    "caat_refs": [],
    "alcoa_ref": "ALCOA-BR-COREN-SP-DEC-PLEN-006-2024"
  },
  "relationships": [
    {
      "type": "CITES",
      "target": "Lei nº 5.905/1973",
      "target_canonical_id": null,
      "class": "DIRECT",
      "force_declared": "NOT_DECLARED",
      "evidence_fragment_ref": null
    },
    {
      "type": "GOVERNS_INTERNAL_PROCESS",
      "target": "Normas internas do Coren-SP",
      "target_canonical_id": null,
      "class": "DIRECT",
      "force_declared": "NOT_DECLARED",
      "evidence_fragment_ref": null
    }
  ],
  "devices": [],
  "projection_catalog": {
    "legislation": [
      "regional-hub",
      "type-index",
      "act-reader"
    ],
    "pages": [
      "article",
      "rich-reference",
      "timeline",
      "relations",
      "evidence"
    ],
    "resources": [
      "checklist",
      "flashcards",
      "glossario",
      "guia-bolso",
      "quiz",
      "slides",
      "simulado",
      "infografico",
      "mapa-mental",
      "caso-aplicado",
      "resumo",
      "questoes-comentadas",
      "podcast",
      "video"
    ],
    "social": [
      "og-default",
      "x-summary-card",
      "linkedin-card",
      "square-post",
      "story",
      "carousel-cover",
      "carousel-slide"
    ],
    "pdf": [
      "longform",
      "summary",
      "pocket-guide",
      "flashcards",
      "simulation"
    ],
    "schema": [
      "WebPage",
      "Legislation",
      "Article",
      "LearningResource",
      "BreadcrumbList"
    ]
  }
}
